{
  "_comment": "Generated by brand-cli score. Do not hand-edit.",
  "version": "1",
  "generated_at": "2026-06-11T01:13:44.094Z",
  "generator": "brand-cli@0.4.0",
  "tier": "standard",
  "readiness": 1,
  "tier_label": "ready",
  "manifest_seen": false,
  "weights": {
    "overview.md": 2,
    "voice.md": 2,
    "tokens/colors.md": 1,
    "tokens/typography.md": 1,
    "tokens/spacing.md": 1,
    "tokens/motion.md": 1,
    "tokens/surfaces.md": 1,
    "composition/page-types.md": 1,
    "composition/patterns.md": 1,
    "composition/anti-patterns.md": 1,
    "conflicts.md": 1,
    "CHANGELOG.md": 1
  },
  "weighted_complete": 14,
  "weighted_total": 14,
  "confidence": "MEDIUM",
  "files": {
    "overview.md": "complete",
    "voice.md": "complete",
    "tokens/colors.md": "complete",
    "tokens/typography.md": "complete",
    "tokens/spacing.md": "complete",
    "tokens/motion.md": "complete",
    "tokens/surfaces.md": "complete",
    "composition/page-types.md": "complete",
    "composition/patterns.md": "complete",
    "composition/anti-patterns.md": "complete",
    "conflicts.md": "complete",
    "CHANGELOG.md": "complete"
  },
  "gaps": [],
  "downgrades": [],
  "client": "acme"
}
